{"assumptions":["All executable B2 inputs remain immutable, compiled, benchmark-mode structured data with exact rational unit definitions.","Provider telemetry did not expose trustworthy marginal duration or cost counters; numeric fields remain zero."],"attempt_manifest_sha256":null,"commands_executed":["Builder ran DIV23_V2_CALCULATION_ASSEMBLY_FOCUSED exactly once before the final assertion-only correction","Controller ran DIV23_V2_CALCULATION_ASSEMBLY_FOCUSED exactly once against final bytes","git diff --check"],"commit_sha":null,"cost_microusd":0,"dependency_effects":[],"duration_ms":0,"external_session_assignment_sha256":"86c16af65dd02d243416a14797fe4a4fbcc652158dff87fb5bae883ab3261204","files_changed":["src/helios_takeoff_core/engine/v2/__init__.py","src/helios_takeoff_core/engine/v2/compiler.py","src/helios_takeoff_core/engine/v2/contracts.py","src/helios_takeoff_core/engine/v2/evaluator.py","src/helios_takeoff_core/engine/v2/formulas.py","src/helios_takeoff_core/engine/v2/schemas/domain-pack-v2.schema.json","src/helios_takeoff_core/engine/v2/schemas/observation-bundle-v1.schema.json","src/helios_takeoff_core/engine/v2/store.py","tests/fixtures/engine_v2/airside_equipment_bundle.json","tests/fixtures/engine_v2/full_division23_calculation_pack.json","tests/fixtures/engine_v2/piping_bundle.json","tests/test_engine_v2_calculation_assembly.py","tests/test_engine_v2_registry_spine.py","tests/test_package_metadata.py"],"focused_test_results":["Builder: 13 of 14 passed; one test-serialization error corrected without rerun","Controller final focused gate: 14 of 14 passed, exit code 0, receipt cc5b39abe09d73b24c6041f0263640a237afe219bc9c9a1a6a336d7e38a6c56c"],"output_kind":"PATCH","patch_sha256":"3c44a58e977acdc4f392a03c182f2916d41808a648a90867ef84e7005ba0989e","protocol":"helios.build.worker-handoff/v1","raw_evidence_sha256":"a4d766aaccde997084f1130da128f4d470639565b9595897a4a34815509ecbc7","security_effects":["Compiler/runtime type and unit agreement now fails closed before evaluation.","Every assembly result or omission retains the source lineage actually used to determine it.","No external execution, provider access, drawing interpretation, database authority, pricing approval, or bid release was added."],"source_packet_ids":[],"source_record_ids":[],"task_manifest_sha256":"d7818473288fea00e14aa44c99d6b05077375edf317c7e772e093028804c9117","transport":"EXTERNAL_SESSION","unresolved_issues":[]}