{"assumptions":["Provider telemetry did not expose a trustworthy marginal cost or total duration counter; numeric fields remain zero."],"attempt_manifest_sha256":null,"commands_executed":["DIV23_V2_REGISTRY_FOCUSED once in the assigned external worktree","Exact previously failing wording assertion once after the message correction","git diff --check"],"commit_sha":null,"cost_microusd":0,"dependency_effects":[],"duration_ms":0,"external_session_assignment_sha256":"d383fb5d48cf76a94727404f64f5b32c89808675442b895b223ad0cd5f26b78d","files_changed":["pyproject.toml","src/helios_takeoff_core/engine/v2/__init__.py","src/helios_takeoff_core/engine/v2/compiler.py","src/helios_takeoff_core/engine/v2/contracts.py","src/helios_takeoff_core/engine/v2/migrations/001_engine_registry.sql","src/helios_takeoff_core/engine/v2/schemas/domain-pack-v2.schema.json","src/helios_takeoff_core/engine/v2/store.py","tests/fixtures/engine_v2/full_division23_registry_pack.json","tests/test_engine_v2_registry_spine.py","tests/test_package_metadata.py"],"focused_test_results":["Initial focused result: 18 of 19 passed; one wording-only assertion failed","Targeted corrected assertion: 1 of 1 passed","Controller authoritative final focused gate required"],"output_kind":"PATCH","patch_sha256":"7eca31d1a8eddba4af68df6dc7e161c4f868e4d70ed53baf7c97adf71eb80810","protocol":"helios.build.worker-handoff/v1","raw_evidence_sha256":"7e10fc1966da20b9ec1979e78819a84436c18dd3ee6c8fd65143b7847b306e68","security_effects":["Concurrent projection reads now use one stable snapshot.","Projection rebuild events carry operation-bound generations and supersession lineage is independently enforced."],"source_packet_ids":[],"source_record_ids":[],"task_manifest_sha256":"4d86abcf67e37d724b8def4ac1e4682f7d90a131a75fd3ff9997ab7161e90835","transport":"EXTERNAL_SESSION","unresolved_issues":[]}