{"assumptions":["R1A is metadata and file transport only; live browser/provider transport and source promotion remain separate governed increments.","Provider telemetry did not expose a trustworthy marginal cost or total duration counter; numeric fields remain zero."],"attempt_manifest_sha256":null,"commands_executed":["ATHENA_PACKET_INTAKE_FOCUSED in the assigned external worktree","git diff --check"],"commit_sha":null,"cost_microusd":0,"dependency_effects":[],"duration_ms":0,"external_session_assignment_sha256":"ef9d655b3d1eecf9b06d4d126c86e094ae90f953a321c0c5f74833296d53d80e","files_changed":["build_control/schemas/athena-worker-profile-v1.schema.json","build_control/schemas/builder-source-bundle-v1.schema.json","build_control/schemas/notebook-manifest-v1.schema.json","build_control/schemas/research-request-v1.schema.json","build_control/schemas/source-packet-v1.schema.json","build_control/schemas/source-record-v1.schema.json","build_control/source_registry/README.md","build_control/source_registry/notebooks.v1.json","build_control/worker_profiles/athena.instructions.v1.md","build_control/worker_profiles/athena.v1.json","tests/test_build_distribution_boundary.py","tests/test_build_research_packets.py","tests/test_build_research_task_input.py","tools/helios_build/cli.py","tools/helios_build/research.py","tools/helios_build/source_registry.py"],"focused_test_results":["GREEN: 12 of 12 tests passed in 4.929 seconds"],"output_kind":"PATCH","patch_sha256":"44b7338338cd91febb98f4d34368a2b7ece9b3356b89842ab23245d3be24cf05","protocol":"helios.build.worker-handoff/v1","raw_evidence_sha256":"2a3797b014276978414eba9e58650451ce97fae361c11553746be1987498a2ac","security_effects":["ATHENA remains unable to write code, runtime databases, rules, quantities, prices, approvals, or bids.","Research source bodies, credentials, browser state, and live NotebookLM identifiers are excluded from Git and the runtime wheel."],"source_packet_ids":[],"source_record_ids":[],"task_manifest_sha256":"8efeed58f367f6984fea4fe3d33c41e27599246011eed26c99219e04caa58979","transport":"EXTERNAL_SESSION","unresolved_issues":[]}