{"assumptions":["Provider telemetry did not expose a trustworthy marginal cost or total duration counter; numeric fields remain zero."],"attempt_manifest_sha256":null,"commands_executed":["DIV23_V2_REGISTRY_FOCUSED once in the assigned external worktree","git diff --check"],"commit_sha":null,"cost_microusd":0,"dependency_effects":[],"duration_ms":0,"external_session_assignment_sha256":"259ac2ef4041783c1bb450323af1891a1be3d6c93530a157db3cbf903af0e4ab","files_changed":["pyproject.toml","src/helios_takeoff_core/engine/v2/__init__.py","src/helios_takeoff_core/engine/v2/compiler.py","src/helios_takeoff_core/engine/v2/contracts.py","src/helios_takeoff_core/engine/v2/migrations/001_engine_registry.sql","src/helios_takeoff_core/engine/v2/schemas/domain-pack-v2.schema.json","src/helios_takeoff_core/engine/v2/store.py","tests/fixtures/engine_v2/full_division23_registry_pack.json","tests/test_engine_v2_registry_spine.py","tests/test_package_metadata.py"],"focused_test_results":["GREEN: 17 of 17 tests passed in 0.260 seconds"],"output_kind":"PATCH","patch_sha256":"03f3b7104e97632cd5ef882b57aa670b44f13b9ead91b30ad76a7f7f2b0f7c64","protocol":"helios.build.worker-handoff/v1","raw_evidence_sha256":"050cc562637711c01d8af3f5da3b101c5467eb9e004a012df0fbf7ab75c42386","security_effects":["Canonical pack headers, projections, and registry event semantics now fail closed under direct database tampering.","SQLite read connections now close deterministically and v1, P0, and P1A boundaries remain unchanged."],"source_packet_ids":[],"source_record_ids":[],"task_manifest_sha256":"009fb2a8b371c83a089f25573e2818043f9dd7b18377b54fa73663c28a265fec","transport":"EXTERNAL_SESSION","unresolved_issues":[]}