{"assumptions":["Provider telemetry did not expose a trustworthy marginal cost or total duration counter; numeric fields remain zero."],"attempt_manifest_sha256":null,"commands_executed":["DIV23_V2_REGISTRY_FOCUSED through the controller verification environment","git diff --check"],"commit_sha":null,"cost_microusd":0,"dependency_effects":[],"duration_ms":0,"external_session_assignment_sha256":"9182868c8ac1b60428b86e08a038ce73d41a64874bfcf6f0415cae7fee8fd201","files_changed":["pyproject.toml","src/helios_takeoff_core/engine/v2/__init__.py","src/helios_takeoff_core/engine/v2/compiler.py","src/helios_takeoff_core/engine/v2/contracts.py","src/helios_takeoff_core/engine/v2/migrations/001_engine_registry.sql","src/helios_takeoff_core/engine/v2/schemas/domain-pack-v2.schema.json","src/helios_takeoff_core/engine/v2/store.py","tests/fixtures/engine_v2/full_division23_registry_pack.json","tests/test_engine_v2_registry_spine.py","tests/test_package_metadata.py"],"focused_test_results":["RED: expected missing v2 implementation","Local GREEN after one error-message correction: 10 of 10","Controller DIV23_V2_REGISTRY_FOCUSED PASS: receipt a939aea798d7320dd637dcc797dbe5d047ef8cf5ed4fa1fa8ddeba790218dc36"],"output_kind":"PATCH","patch_sha256":"1057697c82a43e69119377bf9eb1084da3fe6e62f1316792718b4241f8bcd6b7","protocol":"helios.build.worker-handoff/v1","raw_evidence_sha256":"b00f21bd166cda6c6121757d5be56fb03d95b8c1117abb84053f5ef40652a1fe","security_effects":["Adds an isolated engine-v2 database and rejects existing P0/P1A/v1/unknown schemas before initialization.","Canonical pack bytes remain authoritative; projection and event integrity are checked independently."],"source_packet_ids":[],"source_record_ids":[],"task_manifest_sha256":"af00422557e8eb5bf06b99dfde8c6777d23f8af5c8f760d6bcbc853d2699f486","transport":"EXTERNAL_SESSION","unresolved_issues":[]}