{"assumptions":["B2 accepts benchmark bundles only; PROJECT_BOUND remains reserved and rejected.","Every evaluation receives one explicit immutable pack identity and never resolves latest.","Provider telemetry did not expose trustworthy duration or marginal cost counters; numeric fields remain zero."],"attempt_manifest_sha256":null,"commands_executed":["DIV23_V2_CALCULATION_ASSEMBLY_FOCUSED RED before implementation","DIV23_V2_CALCULATION_ASSEMBLY_FOCUSED after substantive implementation","DIV23_V2_CALCULATION_ASSEMBLY_FOCUSED once after two localized integration corrections","git diff --check after bounded static hardening"],"commit_sha":null,"cost_microusd":0,"dependency_effects":[],"duration_ms":0,"external_session_assignment_sha256":"5810bf1a7e7a12de717d553e0e88db79fac5f8ef2889c97ea49233b582704731","files_changed":["src/helios_takeoff_core/engine/v2/__init__.py","src/helios_takeoff_core/engine/v2/compiler.py","src/helios_takeoff_core/engine/v2/contracts.py","src/helios_takeoff_core/engine/v2/evaluator.py","src/helios_takeoff_core/engine/v2/formulas.py","src/helios_takeoff_core/engine/v2/schemas/domain-pack-v2.schema.json","src/helios_takeoff_core/engine/v2/schemas/observation-bundle-v1.schema.json","src/helios_takeoff_core/engine/v2/store.py","tests/fixtures/engine_v2/airside_equipment_bundle.json","tests/fixtures/engine_v2/full_division23_calculation_pack.json","tests/fixtures/engine_v2/piping_bundle.json","tests/test_engine_v2_calculation_assembly.py","tests/test_engine_v2_registry_spine.py","tests/test_package_metadata.py"],"focused_test_results":["RED: eight expected errors before implementation","First implementation run: two localized integration issues","Allowed correction rerun: all eight focused tests passed","Controller authoritative final focused gate required after four static-audit hardening changes"],"output_kind":"PATCH","patch_sha256":"ddc942643759664ca28954726a6a443a3ccfee3210c9d98532374027880efb4d","protocol":"helios.build.worker-handoff/v1","raw_evidence_sha256":"751289d5db93249b34873c5b0c7a010961fae5df39d526d07097ef0fcf410e71","security_effects":["Formula evaluation is closed, bounded, exact, and excludes callbacks, network, commands, files, environment state, and providers.","Every result is a NON_AUTHORITATIVE_CANDIDATE and no project, approval, quote, or bid state is written.","Directly constructed pack and bundle objects are rebound to canonical content and claimed digests before evaluation."],"source_packet_ids":[],"source_record_ids":[],"task_manifest_sha256":"54cf68822cc8e4f42a0f2e095ee8be55854f51a594bfd1fd9d93e188fd83b164","transport":"EXTERNAL_SESSION","unresolved_issues":[]}