{"assumptions":["Provider telemetry did not expose a trustworthy marginal cost or total duration counter; those numeric fields remain zero."],"attempt_manifest_sha256":null,"commands_executed":["TASK9C_FOCUSED through the controller verification environment","git diff --check"],"commit_sha":null,"cost_microusd":0,"dependency_effects":[],"duration_ms":0,"external_session_assignment_sha256":"123e941ffb32f0090ab7c22a9d2b4cdd11b63b0846883093bc31f5d98c6cc05f","files_changed":["build_control/README.md","tests/test_build_authority_boundary.py","tests/test_build_cli.py","tests/test_build_dispatch.py","tests/test_build_graph.py","tests/test_build_package_boundary.py","tools/helios_build/__main__.py","tools/helios_build/cli.py"],"focused_test_results":["TASK9C_FOCUSED PASS: 11 of 11 behaviors; receipt fee620df19f915b7756f7eb9453d4a78bcdd27757052b3c8180746b70a82f9c7"],"output_kind":"PATCH","patch_sha256":"8ca904c9158e63718e57626b356851d56a8b573600ec0784cfd205eef700b096","protocol":"helios.build.worker-handoff/v1","raw_evidence_sha256":"e15edb555db94f262d7bdb01d6f8fa48d898128fbe6a062dfb3e155c1271086b","security_effects":["The test fixture restores its caller's umask and establishes exact 0755 Git-CAS ancestor custody; production custody validation is unchanged."],"source_packet_ids":[],"source_record_ids":[],"task_manifest_sha256":"3993b8d0bfa76bd18b49b0054d868f073e5404cebcfccd60e4c5565ce0a8f0e9","transport":"EXTERNAL_SESSION","unresolved_issues":[]}