{"assumptions":["Provider did not expose total-duration or marginal-cost counters; numeric counters remain zero"],"attempt_manifest_sha256":null,"commands_executed":["PYTHONPATH=/tmp/helios-build-deps.dgJtTz:src:. python3 -m unittest tests.test_build_cli tests.test_build_package_boundary tests.test_build_authority_boundary -v","git diff --check"],"commit_sha":null,"cost_microusd":0,"dependency_effects":[],"duration_ms":0,"external_session_assignment_sha256":"1458c0bb64426c1c6d916f6ade7211a56bb20eb14c43f803ce9818edd4a44a55","files_changed":["build_control/README.md","tests/test_build_authority_boundary.py","tests/test_build_cli.py","tests/test_build_graph.py","tests/test_build_package_boundary.py","tools/helios_build/__main__.py","tools/helios_build/cli.py"],"focused_test_results":["RED exit 1: expected missing CLI module","TASK9R1_FOCUSED PASS: eight of eight; receipt 56992880dcf7a549dc8aa94c862552fe9c6caa3978d4d6a763bd25ba5da8c2e7"],"output_kind":"PATCH","patch_sha256":"b0ba51a76cfd66cec18bb059dafd0d4de7b51ed259fd50877a8d7c37d0830749","protocol":"helios.build.worker-handoff/v1","raw_evidence_sha256":"34ea6602ed5810ae4bfb8c9c6c59608083659f1af12002ab6f1707c571d536b6","security_effects":["Graph test custody now requires state-root mode 0700 and routing-bound supersession"],"source_packet_ids":[],"source_record_ids":[],"task_manifest_sha256":"c1c0e67a963c90985a5dae08fead23ed1e204e8a5cc51148e7abe11d54ba9c4f","transport":"EXTERNAL_SESSION","unresolved_issues":[]}