{"assumptions":["All cooperating research commands use the same canonical POSIX state_root, owned by the current user with mode 0700.","Provider telemetry did not expose trustworthy duration or marginal cost counters; numeric fields remain zero."],"attempt_manifest_sha256":null,"commands_executed":["ATHENA_PACKET_INTAKE_FOCUSED once with the ambient interpreter","Two previously unimportable focused modules once in the existing verification virtual environment","git diff --check"],"commit_sha":null,"cost_microusd":0,"dependency_effects":[],"duration_ms":0,"external_session_assignment_sha256":"a7770890c8a347aee2e7b10409408b9a98173ac150e6ad038304791f1a413e8c","files_changed":["build_control/schemas/athena-worker-profile-v1.schema.json","build_control/schemas/builder-source-bundle-v1.schema.json","build_control/schemas/notebook-manifest-v1.schema.json","build_control/schemas/research-request-v1.schema.json","build_control/schemas/source-packet-v1.schema.json","build_control/schemas/source-record-v1.schema.json","build_control/source_registry/README.md","build_control/source_registry/notebooks.v1.json","build_control/worker_profiles/athena.instructions.v1.md","build_control/worker_profiles/athena.v1.json","tests/test_build_distribution_boundary.py","tests/test_build_research_packets.py","tests/test_build_research_task_input.py","tools/helios_build/cli.py","tools/helios_build/research.py","tools/helios_build/source_registry.py"],"focused_test_results":["Distribution boundary: 2 of 2 passed in the ambient invocation","Verification-venv packet/task modules: 13 of 16 methods passed before four narrow defects were corrected","Controller authoritative final focused gate required against the final correction bytes"],"output_kind":"PATCH","patch_sha256":"422c539d20e634c1025437b79122ac0aa75e7f9013444e4da035ae88221fae98","protocol":"helios.build.worker-handoff/v1","raw_evidence_sha256":"99818a851ab7e1e2bf430726b8dffec8546d4b2287b8761ef469ed134c2c7a79","security_effects":["Packet publication and request identity now serialize through descriptor-custodied external-state locks.","Registry replay independently proves request, manifest, profile, notebook, jurisdiction, unit, exclusion, citation, authority, and successor lineage.","ATHENA remains unable to write runtime code, databases, rules, quantities, prices, approvals, or bids."],"source_packet_ids":[],"source_record_ids":[],"task_manifest_sha256":"7607569e69e36895aabb4ed87996dfd0701e6745dac1818d4f88e5887f96cf8f","transport":"EXTERNAL_SESSION","unresolved_issues":["The four final narrow corrections were not rerun by the builder under the no-loop budget; the controller focused gate must verify them."]}